<?xml version="1.0"?>
<root xmlns="http://polimi.it/GDMImporter"
      xmlns:xsi="http://www.w3.org/2001/XMLSchema-instance"
      xsi:schemaLocation="http://polimi.it/GDMImporter /Example/xml/configurationSchema.xsd">
    <settings>
        <!--BASE WORKING FOLDER FOR THE IMPORTER-->
        <base_working_directory>/home/hduser/gmql_importer/</base_working_directory>
        <gcm_config_file>/home/hduser/gmql_importer/conf/application.conf</gcm_config_file>
        <flattener_rule_base>/home/hduser/GMQL-sources/Metadata-Manager/Example/flattener_rule_base.txt
        </flattener_rule_base>
        <download_enabled>false</download_enabled>
        <transform_enabled>false</transform_enabled>
        <cleaner_enabled>false</cleaner_enabled>
        <mapper_enabled>false</mapper_enabled>
        <enricher_enabled>false</enricher_enabled>
        <flattener_enabled>true</flattener_enabled>
        <load_enabled>false</load_enabled>
        <parallel_execution>false</parallel_execution>
    </settings>
    <source_list>
        <source name="GRCh38_CISTROME">
            <url>http://cistrome.org/~rongbin/data_release/</url>
            <source_working_directory>cistrome</source_working_directory>
            <downloader>it.polimi.genomics.importer.CistromeImporter.CistromeDownloader</downloader>
            <transformer>it.polimi.genomics.importer.CistromeImporter.CistromeTransformer</transformer>
            <loader>it.polimi.genomics.importer.GMQLImporter.GMQLLoader</loader>
            <download_enabled>true</download_enabled>
            <transform_enabled>true</transform_enabled>
            <cleaner_enabled>true</cleaner_enabled>
            <mapper_enabled>true</mapper_enabled>
            <enricher_enabled>true</enricher_enabled>
            <flattener_enabled>true</flattener_enabled>
            <load_enabled>true</load_enabled>
            <parameter_list>
                <parameter>
                    <description>to know which user in gmql is going to be imported</description>
                    <key>gmql_user</key>
                    <value>leone</value>
                </parameter>
                <parameter>
                    <description>onassis file path</description>
                    <key>onassis_file_path</key>
                    <value>/home/hduser/gmql_importer/conf/onassis.txt</value>
                </parameter>
                <!--<parameter>
                    <description>Cleaner definition rule base file</description>
                    <key>rule_base</key>
                    <value>/home/hduser/gmql_importer/CISTROME_rules.txt</value>
                </parameter>-->
            </parameter_list>
            <dataset_list>
                <dataset name="narrowPeak">
                    <dataset_working_directory>narrowPeak</dataset_working_directory>
                    <schema_url location="local">schemas/narrowPeak.schema</schema_url>
                    <download_enabled>true</download_enabled>
                    <transform_enabled>true</transform_enabled>
                    <cleaner_enabled>true</cleaner_enabled>
                    <mapper_enabled>true</mapper_enabled>
                    <enricher_enabled>true</enricher_enabled>
                    <flattener_enabled>true</flattener_enabled>
                    <load_enabled>true</load_enabled>
                    <parameter_list>
                        <parameter>
                            <key>loading_description</key>
                            <value>This dataset constains ChIP-seq and chromatin accessibility data aligned to human
                                genome assembly GRCh38, collected from the NCBI GEO database, ENCODE database and
                                Roadmap Epigenomics project
                            </value>
                        </parameter>
                        <parameter>
                            <key>file_filter</key>
                            <value>(.*narrowPeak.*)</value>
                        </parameter>
                        <parameter>
                            <key>file_metadata</key>
                            <value>(.*data_information.*)</value>
                        </parameter>
                        <parameter>
                            <key>file_full_path</key>
                            <value>http://cistrome.org/~rongbin/data_release/histone_human.tar.gz</value>
                        </parameter>
                    </parameter_list>
                </dataset>
                <dataset name="broadPeak">
                    <dataset_working_directory>broadPeak</dataset_working_directory>
                    <schema_url location="local">schemas/broadPeak.schema</schema_url>
                    <download_enabled>true</download_enabled>
                    <transform_enabled>false</transform_enabled>
                    <cleaner_enabled>true</cleaner_enabled>
                    <mapper_enabled>true</mapper_enabled>
                    <enricher_enabled>true</enricher_enabled>
                    <flattener_enabled>true</flattener_enabled>
                    <load_enabled>true</load_enabled>
                    <parameter_list>
                        <parameter>
                            <key>loading_description</key>
                            <value>This dataset constains ChIP-seq and chromatin accessibility data aligned to human
                                genome assembly GRCh38, collected from the NCBI GEO database, ENCODE database and
                                Roadmap Epigenomics project
                            </value>
                        </parameter>
                        <parameter>
                            <key>file_filter</key>
                            <value>(.*broadPeak.*)</value>
                        </parameter>
                        <parameter>
                            <key>file_metadata</key>
                            <value>(.*data_information.*)</value>
                        </parameter>
                        <parameter>
                            <key>file_full_path</key>
                            <value>http://cistrome.org/~rongbin/data_release/histone_human.tar.gz</value>
                        </parameter>
                    </parameter_list>
                </dataset>
            </dataset_list>
        </source>
    </source_list>
</root>
