<?xml version="1.0"?>
<root   xmlns="http://polimi.it/GDMImporter"
        xmlns:xsi="http://www.w3.org/2001/XMLSchema-instance"
        xsi:schemaLocation="http://polimi.it/GDMImporter /Example/xml/configurationSchema.xsd">
    <settings>
        <!--BASE WORKING FOLDER FOR THE IMPORTER-->
        <base_working_directory>/Users/canakoglu/Downloads/michele/downloader</base_working_directory>
        <download_enabled>false</download_enabled>
        <transform_enabled>true</transform_enabled>
        <load_enabled>false</load_enabled>
        <parallel_execution>false</parallel_execution>
    </settings>
    <source_list>
        <source name="CISTROME">
            <url>http://cistrome.org/~rongbin/data_release/</url>
            <source_working_directory>cistrome</source_working_directory>
            <downloader>it.polimi.genomics.importer.CistromeImporter.CistromeDownloader</downloader>
            <transformer>it.polimi.genomics.importer.CistromeImporter.CistromeTransformer</transformer>
            <loader>it.polimi.genomics.importer.GMQLImporter.GMQLLoader</loader>
            <download_enabled>true</download_enabled>
            <transform_enabled>true</transform_enabled>
            <load_enabled>true</load_enabled>
            <parameter_list>     
                <parameter>
                    <description>to know which user in gmql is going to be imported</description>
                    <key>gmql_user</key>
                    <value>public</value>
                </parameter>
            </parameter_list>
            <dataset_list>
                <dataset name="HG19_TEST_N">
                    <dataset_working_directory>human_tf</dataset_working_directory>
                    <schema_url location="local">schemas/narrowPeak.schema</schema_url>
                    <download_enabled>true</download_enabled>
                    <transform_enabled>true</transform_enabled>
                    <load_enabled>false</load_enabled>
                    <parameter_list>
                        <parameter>
                            <key>loading_description</key>
                            <value>Pippo description</value>
                        </parameter>
                        <parameter>
                            <key>file_filter</key>
                            <value>(.*narrowPeak.*)</value>
                        </parameter>
                        <parameter>
                            <key>file_metadata</key>
                            <value>(.*data_information.*)</value>
                        </parameter>

                        <parameter>
                            <key>file_full_path</key>
                            <value>http://cistrome.org/~rongbin/data_release/histone_human.tar.gz</value>
                        </parameter>

                    </parameter_list>
                </dataset>
            </dataset_list>
        </source>
    </source_list>
</root>